{
  "artifact": "sitemap",
  "stage": "2",
  "schemaVersion": 1,
  "generated": "2026-05-25T00:00:00.000Z",
  "provenance": "generated",
  "owner": "design-os",
  "lastReviewedAt": "2026-05-25T00:00:00.000Z",
  "sourceHash": "sha256:0000000000000000000000000000000000000000000000000000000000000000",
  "variants": []
}
